<!DOCTYPE Modelo SYSTEM "entidad-comp.dtd">
<PruebaEntidad>
<Entidad id="1">
		<Nombre>Localidad</Nombre>
		<TipoEntidad tipo="MAESTRA_COSA"/>
		<Atributos>
			<Atributo id="1">
				<Nombre>fila</Nombre>
				<Cardinalidad min="1" max="1" />
				<TipoAtributo tipo="CARACTERIZACION" />
			</Atributo>
			<Atributo id="2">
				<Nombre>butaca</Nombre>
				<Cardinalidad min="1" max="1" />
				<TipoAtributo tipo="CARACTERIZACION" />
			</Atributo>
		</Atributos>
		<IdentificadoresInternos>
			<RefAtributo id="1" />
			<RefAtributo id="2" />
		</IdentificadoresInternos>
		<IdentificadoresExternos>
				<RefEntidad id="3" />
				<RefEntidad id="4" />
				<RefEntidad id="8" />
		</IdentificadoresExternos>
</Entidad>
</PruebaEntidad>
